{
  "subject": "数学",
  "scope": "stage4·图形与几何（7-9年级）",
  "topicCount": 11,
  "_origin": "AI 生成的教学常识初稿（非课标原文）。需教研人员审核。",
  "topics": [
    {"id": "cnmt_s4gg_line_angle", "type": "CONCEPTUAL", "subject": "数学", "domain": "图形与几何", "stage": "stage4", "gradeStart": 7, "gradeEnd": 7, "name": "线段、射线、直线与角", "description": "用精确语言定义点、直线、线段、射线；理解角的度量与计算（互余互补）。", "centrality": 0.8, "evidence": ["能区分线段射线直线并用符号表示", "能计算互余互补的角"], "assessmentPrompt": "一个角是 35°，{{name}}能说出它的余角和补角各是多少吗？", "standards": ["moe-cn-2022-math:stage4.gg.rec.1"]},
    {"id": "cnmt_s4gg_parallel", "type": "CONCEPTUAL", "subject": "数学", "domain": "图形与几何", "stage": "stage4", "gradeStart": 7, "gradeEnd": 7, "name": "相交线与平行线", "description": "理解对顶角、邻补角、垂线；掌握平行线的判定与性质（同位角、内错角、同旁内角）。", "centrality": 0.8, "evidence": ["能用平行线判定求角", "能区分判定与性质的使用方向"], "assessmentPrompt": "两条平行线被第三条直线所截，同位角什么关系？{{name}}能说出依据吗？反过来，知道同位角相等能推出什么？", "standards": ["moe-cn-2022-math:stage4.gg.rec.2"]},
    {"id": "cnmt_s4gg_triangle_prop", "type": "CONCEPTUAL", "subject": "数学", "domain": "图形与几何", "stage": "stage4", "gradeStart": 7, "gradeEnd": 7, "name": "三角形的性质", "description": "掌握三角形三边关系、内角和、外角性质；理解三角形的高、中线、角平分线。", "centrality": 0.75, "evidence": ["能用三边关系判断能否构成三角形", "能求三角形内外角"], "assessmentPrompt": "3cm、4cm、8cm 三条线段能围成三角形吗？{{name}}能说出依据吗？", "standards": ["moe-cn-2022-math:stage4.gg.rec.3"]},
    {"id": "cnmt_s4gg_congruent", "type": "PROCEDURAL", "subject": "数学", "domain": "图形与几何", "stage": "stage4", "gradeStart": 8, "gradeEnd": 8, "name": "全等三角形", "description": "理解全等的概念（能完全重合）；掌握判定（SSS、SAS、ASA、AAS、HL）并能写出证明。", "centrality": 0.85, "evidence": ["能识别全等三角形并写出对应关系", "能用判定定理完成证明"], "assessmentPrompt": "证明两个三角形全等，{{name}}知道至少需要几个条件？SSA 行不行？", "standards": ["moe-cn-2022-math:stage4.gg.rec.3"]},
    {"id": "cnmt_s4gg_similar", "type": "PROCEDURAL", "subject": "数学", "domain": "图形与几何", "stage": "stage4", "gradeStart": 9, "gradeEnd": 9, "name": "相似三角形", "description": "理解相似（形状相同大小可能不同）；掌握判定与性质（对应边成比例、对应角相等）。", "centrality": 0.75, "evidence": ["能用相似判定解题", "能利用相似求线段长度"], "assessmentPrompt": "两个相似三角形对应边之比是 2:3，{{name}}能说出它们的周长比和面积比吗？", "standards": ["moe-cn-2022-math:stage4.gg.rec.3"]},
    {"id": "cnmt_s4gg_quad_prop", "type": "CONCEPTUAL", "subject": "数学", "domain": "图形与几何", "stage": "stage4", "gradeStart": 8, "gradeEnd": 8, "name": "特殊四边形的性质与判定", "description": "系统掌握平行四边形、矩形、菱形、正方形的性质与判定及其从属关系。", "centrality": 0.7, "evidence": ["能说出各种四边形的性质和判定", "能理清它们之间的包含关系"], "assessmentPrompt": "{{name}}能说说矩形是特殊的平行四边形吗？再加什么条件它就变成正方形？", "standards": ["moe-cn-2022-math:stage4.gg.rec.4"]},
    {"id": "cnmt_s4gg_circle_prop", "type": "CONCEPTUAL", "subject": "数学", "domain": "图形与几何", "stage": "stage4", "gradeStart": 9, "gradeEnd": 9, "name": "圆的性质", "description": "理解圆心角、圆周角、弦、弧的关系（垂径定理、圆周角定理及其推论）。", "centrality": 0.75, "evidence": ["能用垂径定理求弦长", "能用圆周角定理求角"], "assessmentPrompt": "一条弧所对的圆心角是 80°，{{name}}能说出它所对的圆周角是多少吗？", "standards": ["moe-cn-2022-math:stage4.gg.rec.5"]},
    {"id": "cnmt_s4gg_circle_calc", "type": "PROCEDURAL", "subject": "数学", "domain": "图形与几何", "stage": "stage4", "gradeStart": 9, "gradeEnd": 9, "name": "弧长与扇形面积", "description": "掌握弧长公式 l=nπr/180 和扇形面积公式 S=nπr²/360。", "centrality": 0.55, "evidence": ["能计算弧长和扇形面积", "能处理组合图形面积"], "assessmentPrompt": "半径 6、圆心角 120° 的扇形，{{name}}能算弧长和面积吗？", "standards": ["moe-cn-2022-math:stage4.gg.mea.1"]},
    {"id": "cnmt_s4gg_transform", "type": "CONCEPTUAL", "subject": "数学", "domain": "图形与几何", "stage": "stage4", "gradeStart": 8, "gradeEnd": 9, "name": "图形的变换", "description": "用坐标描述平移、旋转、轴对称、位似变换；理解变换中的不变量。", "centrality": 0.6, "evidence": ["能在坐标系中作变换后的图形", "能用变换解释全等和相似"], "assessmentPrompt": "点 (3,2) 关于 x 轴对称的点是？{{name}}能说说坐标怎么变吗？", "standards": ["moe-cn-2022-math:stage4.gg.mot.1"]},
    {"id": "cnmt_s4gg_coord", "type": "CONCEPTUAL", "subject": "数学", "domain": "图形与几何", "stage": "stage4", "gradeStart": 7, "gradeEnd": 7, "name": "平面直角坐标系", "description": "建立平面直角坐标系，用有序数对 (x,y) 表示点的位置；理解象限和对称点的坐标规律。", "centrality": 0.7, "evidence": ["能在坐标系中描点和读坐标", "能求点关于坐标轴的对称点"], "assessmentPrompt": "点 (-2,5) 在第几象限？{{name}}能说出它关于 y 轴的对称点坐标吗？", "standards": ["moe-cn-2022-math:stage4.gg.pos.1"]},
    {"id": "cnmt_s4gg_proof", "type": "META", "subject": "数学", "domain": "图形与几何", "stage": "stage4", "gradeStart": 8, "gradeEnd": 9, "name": "命题与演绎证明", "description": "理解定义、命题、定理、公理；掌握证明的书写规范（已知、求证、证明），会用综合法和反证法。", "centrality": 0.85, "evidence": ["能判断真假命题并写出反例", "能规范书写一个几何证明"], "assessmentPrompt": "{{name}}能说说'命题'和'定理'的区别吗？证明题为什么要写'因为...所以...'？", "standards": ["moe-cn-2022-math:stage4.gg.prf.1"]}
  ]
}
