{
  "subject": "数学",
  "scope": "stage1·数与代数",
  "topicCount": 12,
  "_origin": "AI 生成的教学常识初稿（非课标原文，非任何教材原文）。针对 1-2 年级认知水平，语言侧重感知、直观与操作。需教研人员审核。",
  "topics": [
    {"id": "cnmt_s1na_num_count20", "type": "CONCEPTUAL", "subject": "数学", "domain": "数与代数", "stage": "stage1", "gradeStart": 1, "gradeEnd": 1, "name": "20以内数的认识与数数", "description": "通过数实物、数图形，认识 1~20 各数，理解数的基数含义（表示几个）和序数含义（表示第几个）。", "centrality": 0.9, "evidence": ["能正确数出 20 以内的物体个数", "能区分'几个'和'第几个'"], "assessmentPrompt": "给{{name}}一堆积木，能数出是几个吗？能指出'第 3 个'是哪一个吗？", "standards": ["moe-cn-2022-math:stage1.na.num.1"]},
    {"id": "cnmt_s1na_num_100", "type": "CONCEPTUAL", "subject": "数学", "domain": "数与代数", "stage": "stage1", "gradeStart": 1, "gradeEnd": 1, "name": "100以内数的认识", "description": "认识 100 以内的数，会用数表示物体的个数；初步体会'十'作为一个计数单位。", "centrality": 0.85, "evidence": ["能一个一个、十个十个地数到 100", "能读、写 100 以内的数"], "assessmentPrompt": "{{name}}能从 47 一个一个数到 53 吗？能从 50 十个十个数到 100 吗？", "standards": ["moe-cn-2022-math:stage1.na.num.1"]},
    {"id": "cnmt_s1na_num_place", "type": "CONCEPTUAL", "subject": "数学", "domain": "数与代数", "stage": "stage1", "gradeStart": 1, "gradeEnd": 2, "name": "个位与十位", "description": "认识个位和十位，理解一个两位数由几个十和几个一组成。", "centrality": 0.8, "evidence": ["能说出一个两位数各位上的数字表示什么", "能用小棒或计数器表示两位数"], "assessmentPrompt": "数字 36 里，{{name}}能说说 3 在什么位、6 在什么位，各表示多少吗？", "standards": ["moe-cn-2022-math:stage1.na.num.1"]},
    {"id": "cnmt_s1na_num_compose", "type": "CONCEPTUAL", "subject": "数学", "domain": "数与代数", "stage": "stage1", "gradeStart": 1, "gradeEnd": 2, "name": "数的组成", "description": "理解两位数由几个十和几个一组成，如 23 = 2 个十 + 3 个一。", "centrality": 0.7, "evidence": ["能把两位数拆成十和一", "能由十和一合成两位数"], "assessmentPrompt": "{{name}}能说出 45 是由几个十和几个一组成的吗？那 6 个十和 2 个一是多少？", "standards": ["moe-cn-2022-math:stage1.na.num.1"]},
    {"id": "cnmt_s1na_num_compare", "type": "PROCEDURAL", "subject": "数学", "domain": "数与代数", "stage": "stage1", "gradeStart": 1, "gradeEnd": 2, "name": "100以内数的大小比较", "description": "比较两位数大小：先比十位，十位相同再比个位；会用 >、<、=。", "centrality": 0.6, "evidence": ["能比较两个两位数的大小", "能用符号表示比较结果"], "assessmentPrompt": "{{name}}会比较 38 和 45 的大小吗？35 和 32 呢？", "standards": ["moe-cn-2022-math:stage1.na.num.1"]},

    {"id": "cnmt_s1na_op_add", "type": "CONCEPTUAL", "subject": "数学", "domain": "数与代数", "stage": "stage1", "gradeStart": 1, "gradeEnd": 1, "name": "加法的初步认识", "description": "通过合并、添上等情境理解加法的含义：把两部分合起来用加法。", "centrality": 0.85, "evidence": ["能用加法表示'合起来'的情境", "能看图列出加法算式"], "assessmentPrompt": "桌上有 3 个苹果，又拿来 2 个，{{name}}能用算式表示一共多少吗？", "standards": ["moe-cn-2022-math:stage1.na.op.1"]},
    {"id": "cnmt_s1na_op_sub", "type": "CONCEPTUAL", "subject": "数学", "domain": "数与代数", "stage": "stage1", "gradeStart": 1, "gradeEnd": 1, "name": "减法的初步认识", "description": "通过拿走、去掉、比较等情境理解减法的含义；体会加减法的互逆关系。", "centrality": 0.8, "evidence": ["能用减法表示'去掉'的情境", "能看图列出减法算式"], "assessmentPrompt": "桌上有 5 朵花，拿走 2 朵，{{name}}能用算式表示还剩多少吗？", "standards": ["moe-cn-2022-math:stage1.na.op.1"]},
    {"id": "cnmt_s1na_op_10", "type": "PROCEDURAL", "subject": "数学", "domain": "数与代数", "stage": "stage1", "gradeStart": 1, "gradeEnd": 1, "name": "10以内加减法", "description": "熟练掌握 10 以内加减法，能进行口算；初步形成数的分与合的表象。", "centrality": 0.9, "evidence": ["能脱口算出 10 以内加减结果", "能说出一个数的组成（如 5 可以分成 2 和 3）"], "assessmentPrompt": "{{name}}能马上说出 4+3 等于几吗？8-5 呢？", "standards": ["moe-cn-2022-math:stage1.na.op.1"]},
    {"id": "cnmt_s1na_op_carry", "type": "PROCEDURAL", "subject": "数学", "domain": "数与代数", "stage": "stage1", "gradeStart": 1, "gradeEnd": 2, "name": "20以内进位加法", "description": "用'凑十法'等方法计算 20 以内进位加法（如 8+5、7+6），理解满十进一的道理。", "centrality": 0.8, "evidence": ["能用凑十法计算 20 以内进位加法", "能解释凑十的过程"], "assessmentPrompt": "{{name}}能算 8+5 吗？说说怎么凑十的。", "standards": ["moe-cn-2022-math:stage1.na.op.1"]},
    {"id": "cnmt_s1na_op_borrow", "type": "PROCEDURAL", "subject": "数学", "domain": "数与代数", "stage": "stage1", "gradeStart": 1, "gradeEnd": 2, "name": "20以内退位减法", "description": "用'破十法''平十法'等方法计算 20 以内退位减法（如 12-5、14-8）。", "centrality": 0.8, "evidence": ["能用一种方法计算 20 以内退位减法", "能联系加法验算减法"], "assessmentPrompt": "{{name}}能算 13-6 吗？能想加算减吗（6 加几等于 13）？", "standards": ["moe-cn-2022-math:stage1.na.op.1"]},
    {"id": "cnmt_s1na_op_100", "type": "PROCEDURAL", "subject": "数学", "domain": "数与代数", "stage": "stage1", "gradeStart": 2, "gradeEnd": 2, "name": "100以内加减法", "description": "口算和笔算 100 以内的加减法（含两位数加减一位数、整十数、两位数），理解相同数位上的数相加减。", "centrality": 0.7, "evidence": ["能口算 100 以内加减", "能用竖式计算 100 以内加减并正确进位退位"], "assessmentPrompt": "{{name}}能算 36+28 吗？用竖式时为什么要个位对个位、十位对十位？", "standards": ["moe-cn-2022-math:stage1.na.op.2"]},

    {"id": "cnmt_s1na_qty_relation", "type": "CONCEPTUAL", "subject": "数学", "domain": "数与代数", "stage": "stage1", "gradeStart": 1, "gradeEnd": 2, "name": "简单的数量关系", "description": "在具体情境中感知'同样多''多几''少几'，能用加减法解决求相差、求总数、求剩余的简单问题。", "centrality": 0.6, "evidence": ["能比较两组物体的多少", "能用加减法解决简单的实际问题"], "assessmentPrompt": "红花 5 朵、黄花 3 朵，{{name}}能说说谁多谁少、多几朵吗？怎么算？", "standards": ["moe-cn-2022-math:stage1.na.qty.1"]}
  ]
}
