{
  "subject": "数学",
  "scope": "细粒度拆分：把粗节点拆成更细的子知识点",
  "topicCount": 20,
  "_origin": "AI 生成的教学常识初稿。把上一版粒度较粗的节点（尤其 stage4 方程/函数/几何定理）拆成更细的可独立教学/评估的子知识点。原粗节点保留作概览。需教研人员审核。",
  "topics": [
    {"id": "cnmt_s4na_eq_property", "type": "CONCEPTUAL", "subject": "数学", "domain": "数与代数", "stage": "stage4", "gradeStart": 7, "gradeEnd": 7, "name": "等式的基本性质", "description": "等式两边同时加/减/乘/除同一个数（除数不为零），结果仍相等；这是解方程的依据。", "centrality": 0.75, "evidence": ["能用等式性质判断变形是否正确", "能说明每步解方程的依据"], "assessmentPrompt": "由 x-3=5 得到 x=8，{{name}}能说出依据等式哪条性质吗？", "standards": ["moe-cn-2022-math:stage4.na.eq.1"]},
    {"id": "cnmt_s4na_linear_eq_solve", "type": "PROCEDURAL", "subject": "数学", "domain": "数与代数", "stage": "stage4", "gradeStart": 7, "gradeEnd": 7, "name": "一元一次方程的解法", "description": "掌握解一元一次方程的一般步骤：去分母、去括号、移项、合并同类项、系数化为 1。", "centrality": 0.8, "evidence": ["能按步骤解含分母括号的方程", "能对每一步说出依据"], "assessmentPrompt": "{{name}}能解 (x-1)/2 - (2x+1)/3 = 1 吗？说说先做什么。", "standards": ["moe-cn-2022-math:stage4.na.eq.1"]},
    {"id": "cnmt_s4na_linear_eq_app", "type": "PROCEDURAL", "subject": "数学", "domain": "数与代数", "stage": "stage4", "gradeStart": 7, "gradeEnd": 7, "name": "一元一次方程的应用", "description": "能用一元一次方程解决行程、工程、利润、配套等实际问题；会设未知数、列方程。", "centrality": 0.7, "evidence": ["能根据实际问题合理设未知数", "能列出方程并求解作答"], "assessmentPrompt": "甲乙两人相距 30 km 相向而行，甲速 5 km/h 乙速 3 km/h，{{name}}能列方程求几小时后相遇吗？", "standards": ["moe-cn-2022-math:stage4.na.eq.1"]},
    {"id": "cnmt_s4na_system_elimination", "type": "PROCEDURAL", "subject": "数学", "domain": "数与代数", "stage": "stage4", "gradeStart": 8, "gradeEnd": 8, "name": "二元一次方程组的消元法", "description": "掌握代入消元法和加减消元法，把二元方程组转化为一元方程。", "centrality": 0.7, "evidence": ["能根据方程组特点选择合适消元法", "能规范写出消元求解过程"], "assessmentPrompt": "解 x+y=7, 3x-y=1，{{name}}用哪种消元法更方便？为什么？", "standards": ["moe-cn-2022-math:stage4.na.eq.2"]},
    {"id": "cnmt_s4na_quadratic_method", "type": "PROCEDURAL", "subject": "数学", "domain": "数与代数", "stage": "stage4", "gradeStart": 9, "gradeEnd": 9, "name": "解一元二次方程的方法", "description": "掌握配方法、公式法、因式分解法三种解一元二次方程的方法，能根据方程特点选用。", "centrality": 0.75, "evidence": ["能用三种方法解一元二次方程", "能选择最简便的方法"], "assessmentPrompt": "x²-7x+12=0 用什么方法最快？{{name}}能说说为什么不用公式法？", "standards": ["moe-cn-2022-math:stage4.na.eq.3"]},
    {"id": "cnmt_s4na_discriminant", "type": "CONCEPTUAL", "subject": "数学", "domain": "数与代数", "stage": "stage4", "gradeStart": 9, "gradeEnd": 9, "name": "一元二次方程根的判别式", "description": "用 Δ=b²-4ac 判断根的情况：Δ>0 两不等实根、Δ=0 两相等实根、Δ<0 无实根。", "centrality": 0.65, "evidence": ["能用判别式判断根的情况", "能由根的情况反推参数范围"], "assessmentPrompt": "方程 x²-2x+k=0 有两个不等实根，{{name}}能说出 k 的范围吗？", "standards": ["moe-cn-2022-math:stage4.na.eq.3"]},
    {"id": "cnmt_s4na_proportional_fn", "type": "CONCEPTUAL", "subject": "数学", "domain": "数与代数", "stage": "stage4", "gradeStart": 8, "gradeEnd": 8, "name": "正比例函数", "description": "形如 y=kx(k≠0) 的函数；图像是过原点的直线，k 决定走向。", "centrality": 0.6, "evidence": ["能画出正比例函数图像", "能由 k 判断增减性"], "assessmentPrompt": "y=-2x 的图像过哪几个象限？{{name}}能说说 y 随 x 怎么变？", "standards": ["moe-cn-2022-math:stage4.na.fn.lc.1"]},
    {"id": "cnmt_s4na_linear_fn_graph", "type": "PROCEDURAL", "subject": "数学", "domain": "数与代数", "stage": "stage4", "gradeStart": 8, "gradeEnd": 8, "name": "一次函数的图像与性质", "description": "用两点法或平移法画 y=kx+b 的图像；由 k、b 判断经过的象限和增减性。", "centrality": 0.75, "evidence": ["能快速画出一次函数图像", "能根据 k、b 完整描述性质"], "assessmentPrompt": "y=3x-2 的图像怎么画最快？{{name}}能说出它过哪几个象限吗？", "standards": ["moe-cn-2022-math:stage4.na.fn.lc.1"]},
    {"id": "cnmt_s4na_fn_eq_link", "type": "CONCEPTUAL", "subject": "数学", "domain": "数与代数", "stage": "stage4", "gradeStart": 8, "gradeEnd": 8, "name": "一次函数与一元一次方程的关系", "description": "理解解方程 kx+b=0 等价于求函数 y=kx+b 与 x 轴交点的横坐标。", "centrality": 0.7, "evidence": ["能用函数图像解释方程的解", "能由图像读出方程的解"], "assessmentPrompt": "看 y=2x-4 的图像与 x 轴交点，{{name}}能说出方程 2x-4=0 的解吗？为什么？", "standards": ["moe-cn-2022-math:stage4.na.fn.lc.1"]},
    {"id": "cnmt_s4na_quad_fn_graph", "type": "PROCEDURAL", "subject": "数学", "domain": "数与代数", "stage": "stage4", "gradeStart": 9, "gradeEnd": 9, "name": "二次函数的图像（抛物线）", "description": "用配方法把 y=ax²+bx+c 化为 y=a(x-h)²+k 形式；确定开口、对称轴、顶点。", "centrality": 0.8, "evidence": ["能用配方法求顶点对称轴", "能画出抛物线草图"], "assessmentPrompt": "y=x²-4x+1，{{name}}能用配方法求顶点和对称轴吗？开口向哪？", "standards": ["moe-cn-2022-math:stage4.na.fn.qf.1"]},
    {"id": "cnmt_s4na_quad_fn_extremum", "type": "PROCEDURAL", "subject": "数学", "domain": "数与代数", "stage": "stage4", "gradeStart": 9, "gradeEnd": 9, "name": "二次函数的最值与应用", "description": "利用顶点或配方法求二次函数的最大值/最小值；解决面积最大、利润最高等实际问题。", "centrality": 0.7, "evidence": ["能求二次函数的最值", "能用最值解决实际问题"], "assessmentPrompt": "用 20 米篱笆围矩形菜地，{{name}}能求出面积最大时的长宽吗？", "standards": ["moe-cn-2022-math:stage4.na.fn.qf.1"]},
    {"id": "cnmt_s4na_inequality_solve", "type": "PROCEDURAL", "subject": "数学", "domain": "数与代数", "stage": "stage4", "gradeStart": 7, "gradeEnd": 7, "name": "一元一次不等式的解法", "description": "类比方程解不等式，特别注意两边乘除负数时不等号方向改变；会在数轴上表示解集。", "centrality": 0.6, "evidence": ["能正确求解并处理变号", "能用数轴表示解集"], "assessmentPrompt": "{{name}}解 -3x ≥ 6，结果是什么？不等号变了吗？", "standards": ["moe-cn-2022-math:stage4.na.eq.4"]},

    {"id": "cnmt_s4gg_vertical_perp", "type": "CONCEPTUAL", "subject": "数学", "domain": "图形与几何", "stage": "stage4", "gradeStart": 7, "gradeEnd": 7, "name": "对顶角、邻补角与垂线", "description": "理解对顶角相等、邻补角互补；掌握垂线的概念与性质（过一点有且只有一条直线与已知直线垂直）。", "centrality": 0.6, "evidence": ["能用对顶角邻补角求角", "能作出垂线并说出性质"], "assessmentPrompt": "两条直线相交，一个角是 35°，{{name}}能求出其余三个角吗？", "standards": ["moe-cn-2022-math:stage4.gg.rec.2"]},
    {"id": "cnmt_s4gg_parallel_judge", "type": "PROCEDURAL", "subject": "数学", "domain": "图形与几何", "stage": "stage4", "gradeStart": 7, "gradeEnd": 7, "name": "平行线的判定", "description": "掌握同位角相等/内错角相等/同旁内角互补 → 两直线平行。", "centrality": 0.7, "evidence": ["能用判定定理证明平行", "能区分三种判定方法"], "assessmentPrompt": "已知同旁内角互补，{{name}}能推出什么？反过来要证平行需要什么条件？", "standards": ["moe-cn-2022-math:stage4.gg.rec.2"]},
    {"id": "cnmt_s4gg_parallel_prop", "type": "PROCEDURAL", "subject": "数学", "domain": "图形与几何", "stage": "stage4", "gradeStart": 7, "gradeEnd": 7, "name": "平行线的性质", "description": "两直线平行 → 同位角相等/内错角相等/同旁内角互补；注意性质与判定方向相反。", "centrality": 0.7, "evidence": ["能用性质求角", "能区分性质与判定的使用方向"], "assessmentPrompt": "两直线平行，同位角什么关系？{{name}}能说出依据吗？", "standards": ["moe-cn-2022-math:stage4.gg.rec.2"]},
    {"id": "cnmt_s4gg_triangle_sides", "type": "CONCEPTUAL", "subject": "数学", "domain": "图形与几何", "stage": "stage4", "gradeStart": 7, "gradeEnd": 7, "name": "三角形三边关系", "description": "三角形任意两边之和大于第三边、任意两边之差小于第三边。", "centrality": 0.55, "evidence": ["能用三边关系判断能否构成三角形", "能求第三边的范围"], "assessmentPrompt": "两根 3cm、6cm 木条要围成三角形，第三根多长才行？{{name}}能说出范围吗？", "standards": ["moe-cn-2022-math:stage4.gg.rec.3"]},
    {"id": "cnmt_s4gg_triangle_angles", "type": "CONCEPTUAL", "subject": "数学", "domain": "图形与几何", "stage": "stage4", "gradeStart": 7, "gradeEnd": 7, "name": "三角形内角和与外角", "description": "三角形内角和 180°；外角等于不相邻两内角之和。", "centrality": 0.65, "evidence": ["能用内角和求未知角", "能用外角性质求角"], "assessmentPrompt": "三角形三个外角的和是多少度？{{name}}能推导吗？", "standards": ["moe-cn-2022-math:stage4.gg.rec.3"]},
    {"id": "cnmt_s4gg_perp_chord_thm", "type": "CONCEPTUAL", "subject": "数学", "domain": "图形与几何", "stage": "stage4", "gradeStart": 9, "gradeEnd": 9, "name": "垂径定理", "description": "垂直于弦的直径平分这条弦及所对的弧；用于求弦长、半径。", "centrality": 0.7, "evidence": ["能用垂径定理求弦长", "能构造直角三角形解题"], "assessmentPrompt": "圆半径 5，一条弦距圆心 3，{{name}}能求弦长吗？", "standards": ["moe-cn-2022-math:stage4.gg.rec.5"]},
    {"id": "cnmt_s4gg_arc_angle_thm", "type": "CONCEPTUAL", "subject": "数学", "domain": "图形与几何", "stage": "stage4", "gradeStart": 9, "gradeEnd": 9, "name": "圆周角定理", "description": "同弧所对的圆周角等于它所对圆心角的一半；同弧所对的圆周角相等。", "centrality": 0.65, "evidence": ["能用圆周角定理求角", "能用直径所对圆周角为直角解题"], "assessmentPrompt": "一条弧所对圆心角 100°，{{name}}能求它所对的圆周角吗？为什么是它的一半？", "standards": ["moe-cn-2022-math:stage4.gg.rec.5"]},
    {"id": "cnmt_s4gg_tangent", "type": "CONCEPTUAL", "subject": "数学", "domain": "图形与几何", "stage": "stage4", "gradeStart": 9, "gradeEnd": 9, "name": "切线的判定与性质", "description": "经过半径外端且垂直于半径的直线是切线；切线性质（切线与半径垂直、切线长定理）。", "centrality": 0.65, "evidence": ["能判定一条直线是不是切线", "能用切线性质求角或线段"], "assessmentPrompt": "怎么判定直线是圆的切线？{{name}}能说出判定定理吗？", "standards": ["moe-cn-2022-math:stage4.gg.rec.5"]}
  ]
}
