{
  "subject": "数学",
  "scope": "图形与几何（stage1-3）",
  "topicCount": 15,
  "_origin": "AI 生成的教学常识初稿（非课标原文）。微主题切分参照 2022 版课标'图形与几何'内容要求。需教研人员审核。",
  "topics": [
    {"id": "cnmt_s1gg_solid_intro", "type": "CONCEPTUAL", "subject": "数学", "domain": "图形与几何", "stage": "stage1", "gradeStart": 1, "gradeEnd": 1, "name": "立体图形的直观认识", "description": "通过实物和模型，直观认识长方体、正方体、圆柱、球等常见立体图形，能按形状分类。", "centrality": 0.6, "evidence": ["能从一堆实物中挑出指定形状的物体", "能说出常见立体图形的名字"], "assessmentPrompt": "给{{name}}一个魔方和一个皮球，能说出它们各是什么形状吗？", "standards": ["moe-cn-2022-math:stage1.gg.rec.1"]},
    {"id": "cnmt_s1gg_plane_intro", "type": "CONCEPTUAL", "subject": "数学", "domain": "图形与几何", "stage": "stage1", "gradeStart": 1, "gradeEnd": 2, "name": "平面图形的直观认识", "description": "直观认识长方形、正方形、三角形、平行四边形、圆等平面图形，能在生活中找到对应的图形。", "centrality": 0.8, "evidence": ["能辨认常见平面图形", "能在实物表面找出平面图形"], "assessmentPrompt": "教室的黑板表面是什么图形？{{name}}能指出钟面的形状吗？", "standards": ["moe-cn-2022-math:stage1.gg.rec.2"]},
    {"id": "cnmt_s1gg_measure_basic", "type": "CONCEPTUAL", "subject": "数学", "domain": "图形与几何", "stage": "stage1", "gradeStart": 1, "gradeEnd": 2, "name": "长度与货币的简单认识", "description": "结合生活情境认识钟表、人民币、简单的长度比较（长短、高矮），初步建立量感。", "centrality": 0.5, "evidence": ["能比较两个物体的长短高矮", "能认识常用的人民币面值"], "assessmentPrompt": "两支铅笔，{{name}}能比出哪支长吗？买东西时认识 1 元硬币吗？", "standards": ["moe-cn-2022-math:stage1.gg.mea.1"]},

    {"id": "cnmt_s2gg_angle", "type": "CONCEPTUAL", "subject": "数学", "domain": "图形与几何", "stage": "stage2", "gradeStart": 2, "gradeEnd": 4, "name": "角的认识与分类", "description": "认识角的形成（一个端点引出两条射线），辨认直角、锐角、钝角，会比较角的大小。", "centrality": 0.6, "evidence": ["能从图形中指出角", "能区分直角、锐角、钝角"], "assessmentPrompt": "三角板上的那个方方的角是什么角？{{name}}能画一个比它小的角吗？", "standards": ["moe-cn-2022-math:stage2.gg.rec.1"]},
    {"id": "cnmt_s2gg_triangle", "type": "CONCEPTUAL", "subject": "数学", "domain": "图形与几何", "stage": "stage2", "gradeStart": 4, "gradeEnd": 4, "name": "三角形的认识", "description": "认识三角形的特征（三条边三个角），能按角或按边分类；了解三角形内角和是 180°。", "centrality": 0.65, "evidence": ["能识别三角形并分类", "能用内角和求未知角"], "assessmentPrompt": "{{name}}能说出三角形按角分有哪几类吗？内角和是多少？", "standards": ["moe-cn-2022-math:stage2.gg.rec.2"]},
    {"id": "cnmt_s2gg_quad", "type": "CONCEPTUAL", "subject": "数学", "domain": "图形与几何", "stage": "stage2", "gradeStart": 4, "gradeEnd": 4, "name": "平行四边形与梯形", "description": "认识平行四边形、梯形的特征；理解长方形、正方形是特殊的平行四边形。", "centrality": 0.6, "evidence": ["能辨认平行四边形和梯形", "能说出长方形/正方形与平行四边形的关系"], "assessmentPrompt": "{{name}}能说说为什么正方形也算平行四边形吗？梯形和平行四边形有什么不同？", "standards": ["moe-cn-2022-math:stage2.gg.rec.3"]},
    {"id": "cnmt_s2gg_perimeter", "type": "CONCEPTUAL", "subject": "数学", "domain": "图形与几何", "stage": "stage2", "gradeStart": 3, "gradeEnd": 4, "name": "周长的认识与计算", "description": "理解周长是图形一周的长度；掌握长方形、正方形周长计算方法。", "centrality": 0.7, "evidence": ["能指出图形的周长", "能计算长方形/正方形周长"], "assessmentPrompt": "一块长方形菜地长 8 米宽 5 米，{{name}}能算出围一圈要多少米篱笆吗？", "standards": ["moe-cn-2022-math:stage2.gg.mea.1"]},
    {"id": "cnmt_s2gg_area_concept", "type": "CONCEPTUAL", "subject": "数学", "domain": "图形与几何", "stage": "stage2", "gradeStart": 3, "gradeEnd": 4, "name": "面积的概念", "description": "理解面积是图形表面的大小，能比较两个图形面积的大小；区分周长与面积。", "centrality": 0.75, "evidence": ["能区分周长和面积", "能用数方格等方法比较面积"], "assessmentPrompt": "一个相框的边框是周长还是面积？相框里能放多大照片又指什么？{{name}}分得清吗？", "standards": ["moe-cn-2022-math:stage2.gg.mea.2"]},
    {"id": "cnmt_s2gg_area_calc", "type": "PROCEDURAL", "subject": "数学", "domain": "图形与几何", "stage": "stage2", "gradeStart": 3, "gradeEnd": 4, "name": "长方形与正方形面积", "description": "掌握长方形面积=长×宽、正方形面积=边长×边长；认识常用面积单位（cm²、dm²、m²）。", "centrality": 0.7, "evidence": ["能计算长方形/正方形面积", "能选择合适的面积单位"], "assessmentPrompt": "课桌面长 6 分米宽 4 分米，{{name}}能算面积吗？用哪个单位合适？", "standards": ["moe-cn-2022-math:stage2.gg.mea.2"]},

    {"id": "cnmt_s3gg_circle", "type": "CONCEPTUAL", "subject": "数学", "domain": "图形与几何", "stage": "stage3", "gradeStart": 6, "gradeEnd": 6, "name": "圆的认识", "description": "认识圆的各部分（圆心、半径、直径），理解同圆中半径都相等、d=2r；初步认识圆是曲线图形。", "centrality": 0.8, "evidence": ["能指出圆心、半径、直径", "能用圆规画指定半径的圆"], "assessmentPrompt": "{{name}}能用圆规画一个半径 3 厘米的圆吗？为什么画的时候针尖不能动？", "standards": ["moe-cn-2022-math:stage3.gg.rec.1"]},
    {"id": "cnmt_s3gg_circle_calc", "type": "PROCEDURAL", "subject": "数学", "domain": "图形与几何", "stage": "stage3", "gradeStart": 6, "gradeEnd": 6, "name": "圆的周长与面积", "description": "理解圆周率 π 的含义；掌握圆周长 C=πd、圆面积 S=πr² 并能应用。", "centrality": 0.75, "evidence": ["能计算圆的周长和面积", "能解释圆周率的由来"], "assessmentPrompt": "一个圆直径 10 厘米，{{name}}能算周长和面积吗？π 一般取多少？", "standards": ["moe-cn-2022-math:stage3.gg.mea.1"]},
    {"id": "cnmt_s3gg_solid", "type": "CONCEPTUAL", "subject": "数学", "domain": "图形与几何", "stage": "stage3", "gradeStart": 6, "gradeEnd": 6, "name": "圆柱与圆锥的认识", "description": "认识圆柱、圆锥的特征（底面、侧面、高），了解它们的展开图。", "centrality": 0.6, "evidence": ["能辨认圆柱和圆锥", "能说出各部分名称"], "assessmentPrompt": "易拉罐是什么形状？{{name}}能指出它的底面和高吗？", "standards": ["moe-cn-2022-math:stage3.gg.rec.2"]},
    {"id": "cnmt_s3gg_surface_vol", "type": "PROCEDURAL", "subject": "数学", "domain": "图形与几何", "stage": "stage3", "gradeStart": 6, "gradeEnd": 6, "name": "表面积与体积", "description": "掌握长方体/正方体表面积和体积计算；圆柱的侧面积、表面积、体积；圆锥体积。认识体积单位及进率。", "centrality": 0.7, "evidence": ["能计算常见立体图形的表面积和体积", "能进行体积单位换算"], "assessmentPrompt": "一个长方体长 5 宽 4 高 3 厘米，{{name}}能算体积吗？表面积呢？", "standards": ["moe-cn-2022-math:stage3.gg.mea.2"]},
    {"id": "cnmt_s3gg_position", "type": "CONCEPTUAL", "subject": "数学", "domain": "图形与几何", "stage": "stage3", "gradeStart": 5, "gradeEnd": 6, "name": "方向与位置", "description": "用方向和距离确定位置；初步用数对（方格纸）表示位置。", "centrality": 0.55, "evidence": ["能根据方向和距离确定物体位置", "能用数对表示方格纸上点的位置"], "assessmentPrompt": "{{name}}在学校操场，能描述图书馆在什么方向、多远吗？", "standards": ["moe-cn-2022-math:stage3.gg.pos.1"]},
    {"id": "cnmt_s3gg_motion", "type": "CONCEPTUAL", "subject": "数学", "domain": "图形与几何", "stage": "stage3", "gradeStart": 5, "gradeEnd": 5, "name": "图形的平移旋转与对称", "description": "辨认生活中的平移、旋转、轴对称现象，能在方格纸上画出简单图形平移后的图形。", "centrality": 0.5, "evidence": ["能区分平移和旋转", "能找出轴对称图形的对称轴"], "assessmentPrompt": "推拉门是平移还是旋转？{{name}}能举出生活中各一个例子吗？", "standards": ["moe-cn-2022-math:stage3.gg.mot.1"]}
  ]
}
