{
  "subject": "数学",
  "scope": "补遗：遗漏知识点 + 粗粒度拆细",
  "topicCount": 13,
  "_origin": "AI 生成的教学常识初稿。补两轮检查发现的缺口：勾股定理、度量单位（时间/质量）、尺规作图、三视图等，以及 stage4 几何的粒度细化。需教研人员审核。",
  "topics": [
    {"id": "cnmt_s1gg_time", "type": "CONCEPTUAL", "subject": "数学", "domain": "图形与几何", "stage": "stage1", "gradeStart": 1, "gradeEnd": 2, "name": "时间的认识（钟表与时分秒）", "description": "认识钟面，会看整时、半时、几时几分；初步认识时、分、秒及其关系（1时=60分，1分=60秒）。", "centrality": 0.5, "evidence": ["能正确读出钟面上的时刻", "知道时分秒之间的进率"], "assessmentPrompt": "给{{name}}一个钟面，能读出现在是几时几分吗？1 时等于多少分？", "standards": ["moe-cn-2022-math:stage1.gg.mea.1"]},
    {"id": "cnmt_s1gg_mass", "type": "CONCEPTUAL", "subject": "数学", "domain": "图形与几何", "stage": "stage1", "gradeStart": 2, "gradeEnd": 2, "name": "质量单位的初步认识（克与千克）", "description": "结合生活情境认识质量单位克和千克，建立 1 克、1 千克的量感（1千克=1000克）。", "centrality": 0.5, "evidence": ["能借助生活实物感受克和千克", "知道克与千克的换算"], "assessmentPrompt": "一个鸡蛋大约几十克？{{name}}能掂量出 1 千克大概多重吗？1 千克等于多少克？", "standards": ["moe-cn-2022-math:stage1.gg.mea.1"]},
    {"id": "cnmt_s2gg_time_cal", "type": "PROCEDURAL", "subject": "数学", "domain": "图形与几何", "stage": "stage2", "gradeStart": 3, "gradeEnd": 3, "name": "时间的计算与年月日", "description": "认识年、月、日及它们的关系（大月小月、平年闰年）；能进行简单的时间计算。", "centrality": 0.45, "evidence": ["能判断某年是否闰年", "能计算经过的时间"], "assessmentPrompt": "{{name}}知道一年有几个月、哪些是大月吗？怎么判断 2024 年是不是闰年？", "standards": ["moe-cn-2022-math:stage2.gg.mea.1"]},
    {"id": "cnmt_s2gg_mass_ext", "type": "CONCEPTUAL", "subject": "数学", "domain": "图形与几何", "stage": "stage2", "gradeStart": 3, "gradeEnd": 3, "name": "吨的认识与质量单位换算", "description": "认识更大的质量单位吨（1吨=1000千克），能进行克、千克、吨之间的换算。", "centrality": 0.4, "evidence": ["知道吨用于计量较重物品", "能完成质量单位换算"], "assessmentPrompt": "一辆卡车载重 5 吨，等于多少千克？{{name}}能说出哪些物品用吨作单位吗？", "standards": ["moe-cn-2022-math:stage2.gg.mea.1"]},

    {"id": "cnmt_s4gg_pythagoras", "type": "CONCEPTUAL", "subject": "数学", "domain": "图形与几何", "stage": "stage4", "gradeStart": 8, "gradeEnd": 8, "name": "勾股定理", "description": "直角三角形两直角边的平方和等于斜边的平方（a²+b²=c²）；能用它求边长、证明和解决实际问题。", "centrality": 0.9, "evidence": ["能用勾股定理求直角三角形的边长", "能用面积法验证勾股定理"], "assessmentPrompt": "直角三角形两直角边 3 和 4，{{name}}能求斜边吗？勾股定理用式子怎么写？", "standards": ["moe-cn-2022-math:stage4.gg.rec.3"]},
    {"id": "cnmt_s4gg_perp_bisector", "type": "CONCEPTUAL", "subject": "数学", "domain": "图形与几何", "stage": "stage4", "gradeStart": 8, "gradeEnd": 8, "name": "线段垂直平分线", "description": "理解线段垂直平分线的定义和性质（垂直平分线上的点到线段两端距离相等）；能作出线段的垂直平分线。", "centrality": 0.6, "evidence": ["能用性质求线段长度", "能用尺规作垂直平分线"], "assessmentPrompt": "为什么线段垂直平分线上的点到两端距离相等？{{name}}能证明吗？", "standards": ["moe-cn-2022-math:stage4.gg.rec.1"]},
    {"id": "cnmt_s4gg_midline", "type": "CONCEPTUAL", "subject": "数学", "domain": "图形与几何", "stage": "stage4", "gradeStart": 8, "gradeEnd": 8, "name": "三角形的中位线", "description": "理解三角形中位线概念；掌握中位线定理（中位线平行第三边且等于第三边一半）。", "centrality": 0.6, "evidence": ["能用中位线定理求边长", "能证明中位线定理"], "assessmentPrompt": "三角形两边中点连线（中位线）和第三边什么关系？{{name}}能说出长度关系吗？", "standards": ["moe-cn-2022-math:stage4.gg.rec.3"]},
    {"id": "cnmt_s4gg_angle_bisector", "type": "CONCEPTUAL", "subject": "数学", "domain": "图形与几何", "stage": "stage4", "gradeStart": 8, "gradeEnd": 8, "name": "角平分线的性质", "description": "理解角平分线定义；掌握角平分线上的点到角两边距离相等这一性质。", "centrality": 0.55, "evidence": ["能用角平分线性质求距离", "能作角平分线"], "assessmentPrompt": "角平分线上的点到角两边距离有什么关系？{{name}}能说明为什么吗？", "standards": ["moe-cn-2022-math:stage4.gg.rec.1"]},
    {"id": "cnmt_s4gg_construction", "type": "PROCEDURAL", "subject": "数学", "domain": "图形与几何", "stage": "stage4", "gradeStart": 8, "gradeEnd": 8, "name": "尺规作图", "description": "用直尺（无刻度）和圆规完成基本作图：作线段、作角、作线段垂直平分线、作角平分线、过一点作已知直线的垂线。", "centrality": 0.55, "evidence": ["能规范完成五种基本作图", "能写出作图步骤和依据"], "assessmentPrompt": "{{name}}能用尺规作一个角等于已知角吗？说说作法依据。", "standards": ["moe-cn-2022-math:stage4.gg.prf.1"]},
    {"id": "cnmt_s4gg_view", "type": "CONCEPTUAL", "subject": "数学", "domain": "图形与几何", "stage": "stage4", "gradeStart": 9, "gradeEnd": 9, "name": "几何体的三视图", "description": "能画出简单几何体（正方体、圆柱、圆锥等组合体）的主视图、左视图、俯视图；由三视图想象原几何体。", "centrality": 0.45, "evidence": ["能画简单组合体的三视图", "能由三视图判断几何体"], "assessmentPrompt": "给一个由小正方体搭成的组合体，{{name}}能画出它的三视图吗？", "standards": ["moe-cn-2022-math:stage4.gg.rec.1"]},
    {"id": "cnmt_s4gg_circle_position", "type": "CONCEPTUAL", "subject": "数学", "domain": "图形与几何", "stage": "stage4", "gradeStart": 9, "gradeEnd": 9, "name": "点、直线与圆的位置关系", "description": "理解点与圆（d<r, d=r, d>r）、直线与圆（相离相切相交）、圆与圆的位置关系；掌握切线的判定与性质。", "centrality": 0.65, "evidence": ["能用 d 与 r 的关系判断位置", "能判定切线并应用切线性质"], "assessmentPrompt": "圆心到直线的距离等于半径时，直线与圆什么关系？{{name}}能说出这条直线叫什么吗？", "standards": ["moe-cn-2022-math:stage4.gg.rec.5"]},
    {"id": "cnmt_s4gg_quad_special", "type": "CONCEPTUAL", "subject": "数学", "domain": "图形与几何", "stage": "stage4", "gradeStart": 8, "gradeEnd": 8, "name": "矩形、菱形与正方形", "description": "在平行四边形基础上，掌握矩形（有一个直角）、菱形（邻边相等）、正方形（既是矩形又是菱形）的性质与判定。", "centrality": 0.7, "evidence": ["能说出三种特殊四边形的性质和判定", "能理清它们的从属关系"], "assessmentPrompt": "{{name}}能说说正方形、矩形、菱形之间的关系吗？判定一个平行四边形是矩形需要什么条件？", "standards": ["moe-cn-2022-math:stage4.gg.rec.4"]},

    {"id": "cnmt_s4sp_inference", "type": "CONCEPTUAL", "subject": "数学", "domain": "统计与概率", "stage": "stage4", "gradeStart": 9, "gradeEnd": 9, "name": "用样本估计总体", "description": "理解用样本统计量（如样本平均数、样本方差）估计总体相应特征的思想；体会样本容量对估计精度的影响。", "centrality": 0.45, "evidence": ["能用样本数据估计总体特征", "能说明抽样的合理性"], "assessmentPrompt": "抽 100 名学生的平均身高估计全校学生平均身高，{{name}}说这依据是什么？样本大些好还是小些好？", "standards": ["moe-cn-2022-math:stage4.sp.anl.1"]}
  ]
}
